docid,url,domain,title,passage
IGatj9CndNrz,https://sudact.ru/regular/doc/IGatj9CndNrz/,sudact.ru,Решение № 2-200/2019 2-200/2019(2-3621/2018...) :: СудАкт.ру,"Статья 14 Закона о защите прав потребителей предусматривает, что вред, причиненный жизни, здоровью или имуществу потребителя вследствие конструктивных, производственных, рецептурных или иных недостатков товара (работы, услуги), подлежит возмещению в полном объеме. Вред, причиненный вследствие недостатков работы или услуги, подлежит возмещению исполнителем."
17KhMs8uDxmn,https://sudact.ru/regular/doc/17KhMs8uDxmn/,sudact.ru,Решение № 2-2624/2017 от 20 июня 2017 г. по делу... :: СудАкт.ру,"В соответствии со статьей 14 Закона РФ «О защите прав потребителей» вред, причиненный жизни, здоровью или имуществу потребителя вследствие конструктивных, производственных, рецептурных или иных недостатков товара (работы, услуги), подлежит возмещению в полном объеме. Право требовать возмещения вреда, причиненного вследствие недостатков товара (работы, услуги), признается за любым потерпевшим независимо от того, состоял он в договорных отношениях с продавцом (исполнителем) или нет."
UMSVHkiyiN6Q,https://sudact.ru/regular/doc/UMSVHkiyiN6Q/,sudact.ru,Решение № 2-1042/2017 от 6 декабря 2017 г. по делу... :: СудАкт.ру,"В соответствии с п.1 ст.14 Закона «О защите прав потребителей» вред, причиненный жизни, здоровью или имуществу потребителя вследствие конструктивных, производственных, рецептурных или иных недостатков товара (работы, услуги), подлежит возмещению в полном объеме. Согласно пункту 1 статьи 38 Федерального закона от 26.03.2003 г. N 35-ФЗ ""Об электроэнергетике"" субъекты электроэнергетики, обеспечивающие поставки электрической энергии потребителям электрической энергии..."
bgSVj285E3ZP,https://sudact.ru/regular/doc/bgSVj285E3ZP/,sudact.ru,Решение № 2-2425/2015 2-2425/2015~М-2779/2015... :: СудАкт.ру,"применяться общие положения Закона о защите прав потребителей, в частности о праве граждан на предоставление информации (статьи 8 - 12), об ответственности за нарушение прав потребителей (статья 13), о возмещении вреда (статья 14), о компенсации морального вреда (статья 15), об альтернативной подсудности (пункт 2 статьи 17), а также об освобождении от уплаты государственной пошлины."
C9SrxQGQwsxa,https://sudact.ru/regular/doc/C9SrxQGQwsxa/,sudact.ru,Решение № 2-2799/2020 2-2799/2020~М-2605/2020... :: СудАкт.ру,"При этом в соответствии со статьей 1098 Гражданского кодекса РФ и пунктом 5 статьи 14 Закона РФ «О защите прав потребителей» исполнитель услуги освобождается от ответственности в случае, если докажет, что вред возник вследствие непреодолимой силы или нарушения потребителем установленных правил пользования товаром, результатами работы, услуги или их хранения."
eNap3egF8yYP,https://sudact.ru/regular/doc/eNap3egF8yYP/,sudact.ru,Решение № 2-575/2019 2-575/2019(2-7340/2018...) :: СудАкт.ру,"Согласно статье 14 (пункты 1, 2) Закона о защите прав потребителей вред, причиненный жизни, здоровью или имуществу потребителя вследствие конструктивных, производственных, рецептурных или иных недостатков товара (работы, услуги), подлежит возмещению в полном объеме. Право требовать возмещения вреда, причиненного вследствие недостатков товара (работы, услуги), признается за любым потерпевшим независимо от того, состоял он в договорных отношениях с продавцом (исполнителем) или нет."
2CFuVIPm27d0,https://sudact.ru/regular/doc/2CFuVIPm27d0/,sudact.ru,Решение № 2-3705/2017 от 26 ноября 2017 г. по делу... :: СудАкт.ру,"На основании статьи 14 (пункты 1, 2, 3) Закона о защите прав потребителей, вред, причиненный жизни, здоровью или имуществу потребителя вследствие конструктивных, производственных, рецептурных или иных недостатков товара (работы, услуги), подлежит возмещению в полном объеме. Право требовать возмещения вреда, причиненного вследствие недостатков товара (работы, услуги), признается за любым потерпевшим независимо от того, состоял он в договорных отношениях с продавцом (исполнителем) или нет."
TDpRFW3KQ4xW,https://sudact.ru/regular/doc/TDpRFW3KQ4xW/,sudact.ru,Решение № 2-374/2020 2-374/2020(2-5473/2019...) :: СудАкт.ру,"Статьей 7 Закона РФ от. ДД.ММ.ГГГГ № «О защите прав потребителей» установлено право потребителя на то, чтобы услуга не причиняла вред его имуществу. При этом статьей 14 Закона РФ от ДД.ММ.ГГГГ № «О защите прав потребителей» предусмотрено, что право требовать возмещения вреда, причиненного вследствие недостатков товара (работы, услуги), признается за любым потерпевшим независимо от того, состоял он в договорных отношениях с продавцом (исполнителем) или нет."
rzLiynLmxaxN,https://sudact.ru/regular/doc/rzLiynLmxaxN/,sudact.ru,Решение № 01070/2018 2-2448/2018 2-8/2019 2-8/2019... :: СудАкт.ру,"Статьей 7 Закона «О защите прав потребителей» предусмотрено, что потребитель имеет право на то, чтобы товар (работа, услуга) при обычных условиях его использования, хранения, транспортировки и утилизации был безопасен для жизни, здоровья потребителя, окружающей среды, а также не причинял вред имуществу потребителя."
k2cPUTq3HDrX,https://sudact.ru/regular/doc/k2cPUTq3HDrX/,sudact.ru,Решение № 2-1207/2016 2-18/2017 от 16 мая 2017 г. по... :: СудАкт.ру,"В силу статьи 14 Закона Российской Федерации ""О защите прав потребителей"" вред, причиненный жизни, здоровью или имуществу потребителя вследствие конструктивных, производственных, рецептурных или иных недостатков товара (работы, услуги), подлежит возмещению в полном объеме. Право требовать возмещения вреда, причиненного вследствие недостатков услуги, признается за любым потерпевшим независимо от того, состоял он в договорных отношениях с продавцом (исполнителем) или нет."
PRsbw5Saq5VW,https://sudact.ru/regular/doc/PRsbw5Saq5VW/,sudact.ru,Решение № 2-2141/2020 2-2141/2020~М-1552/2020... :: СудАкт.ру,"В соответствии со ст. 14 Закона РФ «О защите прав потребителей», имущественная ответственность за вред, причиненный вследствие недостатков товара (работы, услуги), вред, причиненный жизни, здоровью или имуществу потребителя вследствие конструктивных, производственных, рецептурных или иных недостатков товара (работы, услуги), подлежит возмещению в полном объеме."
djw9QhNugpNF,https://sudact.ru/regular/doc/djw9QhNugpNF/,sudact.ru,Решение № 2-290/2020 2-290/2020(2-3726/2019...) :: СудАкт.ру,"Заслуживает внимания также и то обстоятельство, что ООО «Сигма-Юг» по отношению к истцу является лицом, оказывающим услугу по содержанию общего имущества многоквартирного дома. В соответствии со статьями 7, 14 Закона о защите прав потребителей истец как потребитель вправе рассчитывать на безопасность и качество услуг. Вред, причиненный потребителю вследствие недостатков услуг, подлежит возмещению исполнителем в полном объеме независимо от его вины."
iX3Ly6r8T7WO,https://sudact.ru/regular/doc/iX3Ly6r8T7WO/,sudact.ru,Решение № 2-123/2020 2-123/2020(2-2806/2019...) :: СудАкт.ру,"Согласно пункту 1 статьи 7 Закона РФ ""О защите прав потребителей"" потребитель имеет право на то, чтобы товар (работа, услуга) при обычных условиях его использования, хранения, транспортировки и утилизации был безопасен для жизни, здоровья потребителя, окружающей среды, а также не причинял вред имуществу потребителя."
ubkSUbequjg9,https://sudact.ru/regular/doc/ubkSUbequjg9/,sudact.ru,Решение № 2-2466/2020 2-2466/2020~М-1968/2020... :: СудАкт.ру,"В силу п.1 ст.14 Закона РФ «О защите прав потребителей» вред, причиненный жизни, здоровью или имуществу потребителя вследствие конструктивных, производственных, рецептурных или иных недостатков товара (работы, услуги), подлежит возмещению в полном объеме. В соответствии со ст.29, ст.31 Закона РФ «О защите прав потребителей» потребитель при обнаружении недостатков оказанной услуги вправе по своему выбору потребовать возмещения понесенных им расходов по устранению недостатков..."
L6OX0C4vODr8,https://sudact.ru/regular/doc/L6OX0C4vODr8/,sudact.ru,Решение № 2-940/2020 2-940/2020~М-243/2020... :: СудАкт.ру,"В соответствии со ст.15 Закона РФ «О защите прав потребителей» моральный вред, причиненный потребителю вследствие нарушения изготовителем (исполнителем, продавцом, уполномоченной организацией или уполномоченным индивидуальным предпринимателем, импортером) прав потребителя, предусмотренных законами и правовыми актами РФ, регулирующими отношения в области защиты прав потребителей, подлежит компенсации причинителем вреда при наличии его вины."
trH3J3RlerN5,https://sudact.ru/regular/doc/trH3J3RlerN5/,sudact.ru,Решение № 2-2181/2023 2-2181/2023~М-1253/2023... :: СудАкт.ру,"Статьей 7 Закона о защите прав потребителей установлено, что потребитель имеет право на то, чтобы товар (работа, услуга) при обычных условиях его использования, хранения, транспортировки и утилизации был безопасен для жизни, здоровья потребителя, окружающей среды, а также не причинял вред имуществу потребителя."
i0B35yZwIzoX,https://sudact.ru/regular/doc/i0B35yZwIzoX/,sudact.ru,Решение № 2-2706/2019 2-41/2020 2-41/2020... :: СудАкт.ру,"Вред, причиненный жизни, здоровью или имуществу потребителя вследствие необеспечения безопасности товара (работы), подлежит возмещению в соответствии со статьей 14 настоящего Закона. Пунктом 1 статьи 14 Закона Российской Федерации от 07.02.1992 № 2300-1 ""О защите прав потребителей"" предусмотрено, что вред, причиненный жизни, здоровью или имуществу потребителя вследствие конструктивных, производственных, рецептурных или иных недостатков товара (работы, услуги), подлежит возмещению в полном объеме."
52yel0MbTAQv,https://sudact.ru/regular/doc/52yel0MbTAQv/,sudact.ru,Решение № 2-390/2019 2-6/2020 2-6/2020(2-390/2019...) :: СудАкт.ру,"Согласно статье 15 Закона о защите прав потребителей моральный вред, причиненный потребителю вследствие нарушения исполнителем прав потребителя, предусмотренных законами и правовыми актами Российской Федерации, регулирующими отношения в области защиты прав потребителей, подлежит компенсации причинителем вреда при наличии его вины."
awc1JLDcrjU1,https://sudact.ru/regular/doc/awc1JLDcrjU1/,sudact.ru,Решение № 2-677/2021 2-677/2021~М-4245/2020... :: СудАкт.ру,"На основании ст. 14 Закона о защите прав потребителей вред, причиненный жизни, здоровью или имуществу потребителя вследствие конструктивных, производственных, рецептурных или иных недостатков товара (работы, услуги), подлежит возмещению в полном объеме. | Статья 29 Закона РФ «О защите прав потребителей» закрепляет, что потребитель при обнаружении недостатков выполненной работы (оказанной услуги) вправе по своему выбору потребовать безвозмездного устранения недостатков выполненной работы (оказанной услуги)."
fQ9CnnwDk75h,https://sudact.ru/regular/doc/fQ9CnnwDk75h/,sudact.ru,Решение № 2-397/2020 2-397/2020~М-85/2020... :: СудАкт.ру,"Статьями 13,14 Закона предусмотрено, что за нарушение прав потребителей изготовитель (исполнитель, продавец, уполномоченная организация или уполномоченный индивидуальный предприниматель, импортер) несет ответственность, предусмотренную законом или договором. Вред, причиненный жизни, здоровью или имуществу потребителя вследствие конструктивных, производственных, рецептурных или иных недостатков товара (работы, услуги), подлежит возмещению в полном объеме."
