docid,url,domain,title,passage
FTrYrTTzEals,https://sudact.ru/regular/doc/FTrYrTTzEals/,sudact.ru,Решение № 2-5837/2023 2-5837/2023~М-4399/2023... :: СудАкт.ру,"Истец обратился в суд с иском к ООО «Маркетплейс» о защите прав потребителей, взыскании денежных средств, неустойки, штрафа, компенсации морального вреда указывая, что 11.06.2023 г. посредством сети «Интернет», т.е. дистанционным способом, на сайте СберМегаМаркет, принадлежащего ООО «МАРКЕТПЛЕЙС», истцом был заключен договор купли-продажи смартфона Apple iPhone 14 Pro Max 1024Gb Space Black (2sim) IMEL/MEID № стоимостью 167990."
wzkaHAf8E21E,https://sudact.ru/regular/doc/wzkaHAf8E21E/,sudact.ru,Решение № 2-1742/2025 2-1742/2025~М-810/2025... :: СудАкт.ру,"Истец полагает, что ООО ""Маркетплейс"" должно нести ответственность по Закону РФ ""О защите прав потребителей"" не только как владелец агрегатора информации о товарах, но и как продавец, поскольку ответчик разместил на площадке ""Мегамаркет"" недостоверную информацию о продавце товара из-за чего истец воспринимал ООО ""Маркетплейс"" как продавца ноутбуков."
p103xklic1mg,https://sudact.ru/regular/doc/p103xklic1mg/,sudact.ru,Решение № 2-1922/2025 2-1922/2025~М-540/2025... :: СудАкт.ру,"Иск ФИО1 к ООО «Маркетплейс» о защите прав потребителя удовлетворить частично. Взыскать с ООО «Маркетплейс» (ИНН <***>) в пользу ФИО1 (паспорт №) убытки в виде разницы стоимости товара в размере 1607000 руб., неустойку за период с 15.12.2024 по 13.05.2025 в размере 170000 руб., компенсацию морального вреда в размере 5 000 руб., штраф за несоблюдение в добровольном порядке удовлетворения требований потребителя в размере 160000 руб."
lxw63q3TtAZj,https://sudact.ru/regular/doc/lxw63q3TtAZj/,sudact.ru,Решение № 2-484/2025 2-484/2025(2-6866/2024...) :: СудАкт.ру,"при секретаре Богдановой Н.В., рассмотрев в открытом судебном заседании гражданское дело по иску ФИО4 к ООО «МАРКЕТПЛЕЙС», АО «ЦЕНТР ПРОГРАММ ЛОЯЛЬНОСТИ» о защите прав потребителя | Аналогичное определение продажи товаров дистанционным способом дано в пункте 1 статьи 26.1 Закона Российской Федерации от 7 февраля 1992 г. N 2300-1 «О защите прав потребителей» (далее - Закон о защите прав потребителей)."
5M1CUDzM98LB,https://sudact.ru/regular/doc/5M1CUDzM98LB/,sudact.ru,Решение № 2-6372/2025 2-6372/2025~М-4658/2025... :: СудАкт.ру,"ООО «Маркетплейс» потребителю предоставлена ненадлежащая информация о продавце, что является основанием для возложения на агрегатора ответственности за нарушение прав потребителя. Просил суд взыскать с ООО «Маркетплейс» в пользу ФИО1 убытки в размере 1 412 720 рублей; убытки, понесенные в результате оплаты экспертного заключения № ... от 11 июня."
4nJ71tJWGLLr,https://sudact.ru/regular/doc/4nJ71tJWGLLr/,sudact.ru,Решение № 2-1951/2025 2-1951/2025~М-236/2025... :: СудАкт.ру,"Статьей 15 Закона «О защите прав потребителей» предусмотрено, что моральный вред, причиненный потребителю вследствие нарушения изготовителем (исполнителем, продавцом, уполномоченной организацией или уполномоченным индивидуальным предпринимателем, импортером) прав потребителя, предусмотренных законами и правовыми актами Российской Федерации, регулирующими отношения в области защиты прав потребителей, подлежит компенсации причинителем вреда при наличии его вины."
ByA2BTi7BoHa,https://sudact.ru/regular/doc/ByA2BTi7BoHa/,sudact.ru,Решение № 2-286/2025 2-286/2025~М-49/2025... :: СудАкт.ру,"ФИО1 обратилась в суд с иском к ООО «НР-ЦЕНТР», ООО «Маркетплейс» о защите прав потребителя, в котором просит с учетом последующего уточнения требований взыскать солидарно с ответчиков убытки в виде разницы стоимости товара в размере 954945 руб., компенсацию морального вреда - 15000 руб., штраф в размере 50 %; с ответчика ООО «Маркетплейс» просит взыскать неустойку в размере 763956 руб."
x6ed9pqkhSoh,https://sudact.ru/regular/doc/x6ed9pqkhSoh/,sudact.ru,Решение № 2-9179/2024 2-953/2025 2-953/2025... :: СудАкт.ру,"ООО «Маркетплейс» потребителю предоставлена ненадлежащая информация о продавце, что является основанием для возложения на агрегатора ответственности за нарушение прав потребителя. | течение которого действует предложение о заключении договора (пункт 2 статьи 26.1 Закона о защите прав потребителей)."
fVJm3HMVkt5H,https://sudact.ru/regular/doc/fVJm3HMVkt5H/,sudact.ru,Решение № 2-547/2020 2-547/2020~М-520/2020... :: СудАкт.ру,"исковые требования ФИО1 к обществу с ограниченной ответственностью «СЕЛЛЕР» о защите прав потребителей, удовлетворить частично. Взыскать с общества с ограниченной ответственностью «СЕЛЛЕР» в пользу ФИО1 неустойку за нарушение срока передачи предварительно оплаченного товара потребителю в размере 287 (двухсот восьмидесяти семи) рублей, компенсацию морального вреда, причиненного потребителю, в размере 1 000 (одной тысяч) рублей, штраф в размере 643 (шестисот сорока трех) рублей 50 копеек."
Xv7HfiRU2tVq,https://sudact.ru/regular/doc/Xv7HfiRU2tVq/,sudact.ru,Решение № 2-645/2023 от 15 августа 2023 г. по делу... :: СудАкт.ру,"Обязанность продавца, предусмотреннаяпунктом 3 статьи 26.1Закона Российской Федерации ""О защите прав потребителей"", признается исполненной также в случае предоставления потребителю информации с помощью электронных и иных технических средств. При дистанционном способе продажи товара обязанность продавца по возврату денежной суммы, уплаченной потребителем по договору розничной купли-продажи, возникает в соответствии спунктом 4 статьи..."
nfLIiVfnIsbj,https://sudact.ru/regular/doc/nfLIiVfnIsbj/,sudact.ru,Решение № 2-1233/2023 2-1233/2023~М-443/2023... :: СудАкт.ру,"Маркетплейс не является уполномоченным лицом продавца в смысле законодательства о защит прав потребителей. Маркетплейс не несет ответственность за возможность выполнения заказа продавцом и не гарантирует выполнение заказа со стороны продавца. На основании вышеизложенного, суд полагает неустановленным факт причинения действиями ООО «Маркетплейс» ФИО4 убытков в размере 209 947 рублей, и правовых оснований для удовлетворения требований в данной части не имеется."
7ng73tMHgy5O,https://sudact.ru/regular/doc/7ng73tMHgy5O/,sudact.ru,Решение № 2-6586/2025 2-6586/2025~М-4926/2025... :: СудАкт.ру,"ФИО2 обратился в суд с исковым заявлением к ООО «Маркетплейс» о защите прав потребителей, указав, что после ознакомления с предложенным описанием товара, размещенным в информационно-телекоммуникационной сети «Интернет» посредством торговой площадки (агрегатор) «Мегамаркет» (ООО «Маркетплейс»), была акцептована оферта ООО «Амзито» о розничной купли-продаже товара"
FQi78fsHgSYx,https://sudact.ru/regular/doc/FQi78fsHgSYx/,sudact.ru,Решение № 2-1593/2025 2-1593/2025~М-204/2025... :: СудАкт.ру,"Закона о защите прав потребителей, предусмотрено, что договор розничной купли-продажи может быть заключен на основании ознакомления потребителя с предложенным продавцом описанием товара посредством каталогов, проспектов, буклетов, фотоснимков, средств связи (телевизионной, почтовой, радиосвязи и других) или иными исключающими возможность непосредственного ознакомления потребителя с товаром либо образцом товара при заключении такого договора (дистанционный способ продажи товара) способами."
Sgq21BEqhrWO,https://sudact.ru/regular/doc/Sgq21BEqhrWO/,sudact.ru,Решение № 2-4623/2023 2-4623/2023~М-3113/2023... :: СудАкт.ру,"Порядок дистанционного способа продажи товара установлен статьёй 26.1 Закона Российской Федерации от 07 февраля 1992 года № 2300-1 «О защите прав потребителей», а также Правилами продажи товаров дистанционным способом, утверждёнными Постановлением Правительства Российской Федерации от 27 сентября 2007 года № 612."
xwrG3d38fUVg,https://sudact.ru/regular/doc/xwrG3d38fUVg/,sudact.ru,Решение № 2-335/2024 2-335/2024(2-6536/2023...) :: СудАкт.ру,"Маркетплейс может оказывать потребителям услугу доставки Товара как на возмездной, так и на безвозмездной основе. В правоотношениях с потребителями маркетплейс выступает в качестве владельца агрегатора информации о товарах и не является продавцом товара. | Закон о защите прав потребителей может распространяться на маркетинговые программы, например при доведении до потребителей недостоверной информации о порядке начисления бонусных баллов."
mJA08TMXuhUr,https://sudact.ru/regular/doc/mJA08TMXuhUr/,sudact.ru,Решение № 2-4003/2017 от 26 октября 2017 г. по делу... :: СудАкт.ру,"Статья 28 Закона «О защите прав потребителей» предусматривает последствия нарушения исполнителем сроков выполнения работ (оказания услуг). Так, если исполнитель нарушил сроки выполнения работы (оказания услуги) - сроки начала и (или) окончания выполнения работы (оказания услуги) и (или) промежуточные сроки выполнения работы (оказания услуги) или во время выполнения работы (оказания услуги) стало очевидным, что она не будет выполнена в срок, потребитель по своему выбору вправе..."
3CbF7Lc1r1LN,https://sudact.ru/regular/doc/3CbF7Lc1r1LN/,sudact.ru,Решение № 2-2695/2017 от 7 декабря 2017 г. по делу... :: СудАкт.ру,"В силу пункта 1 статьи 27 Закона о защите прав потребителей исполнитель обязан осуществить выполнение работы в срок, установленный договором о выполнении работ. | К существенным отступлениям от условий договора статья 28 Закона о защите прав потребителей относит нарушение сроков выполнения работы."
wFi2vxSxKHln,https://sudact.ru/regular/doc/wFi2vxSxKHln/,sudact.ru,Решение № 2-2167/2019 2-2167/2019~М-2407/2019... :: СудАкт.ру,"В соответствии с частью 1 статьи 27 Закона Российской Федерации ""О защите прав потребителей"" №2300-1 от 07 февраля 1992 года исполнитель обязан осуществить выполнение работы в срок, установленный договором о выполнении работ. Статья 28 Закона Российской Федерации ""О защите прав потребителей"" №2300-1 от 07 февраля 1992 года предусматривает ответственность исполнителя за нарушение срока выполнения работ."
Lo4QjMzsb9ln,https://sudact.ru/regular/doc/Lo4QjMzsb9ln/,sudact.ru,Решение № 2-1077/2019 2-1077/2019~М-986/2019... :: СудАкт.ру,"В рассматриваемом случае установлены сроки начала работ – следующий день после поступления авансового платежа, то есть не позднее 19 марта 2019 года. Сроки окончания работ – в течении 60 календарных дней, то есть – до 16 мая 2019, которые, как установлено судом, ответчиком нарушены. Статья 28 Закона о защите прав потребителей предусматривает последствия нарушения исполнителем сроков выполнения работ (оказания услуг)."
YNoOFAgZJmLv,https://sudact.ru/regular/doc/YNoOFAgZJmLv/,sudact.ru,Решение № 2-2669/2018 2-2669/2018~М-1223/2018... :: СудАкт.ру,"Договора, поставили начальный срок выполнения Подрядчиком работ по договору, в зависимость от момента первого платежа на сумму 1 063 000 рублей совершенного Заказчиком по договору. | Согласно статье 32 Закона о защите прав потребителей потребитель вправе отказаться от исполнения договора о выполнении работ (оказании услуг) в любое время при условии оплаты исполнителю фактически понесенных им расходов, связанных с исполнением обязательств по данному договору."
0qJvaL8TjRNK,https://sudact.ru/regular/doc/0qJvaL8TjRNK/,sudact.ru,Решение № 2-192/2020 2-192/2020(2-5926/2019...) :: СудАкт.ру,"Согласно пункта 5 статьи 28 Закона РФ «О защите прав потребителей» в случае нарушения установленных сроков выполнения работы или назначенных потребителем на основании пункта 1 настоящей статьи новых сроков исполнитель уплачивает потребителю за каждый день (час, если срок определен в часах) просрочки неустойку в размере 3 % цены выполнения работы, а если цена выполнения работы договором о выполнении работ не определена - общей цены заказа."
8U4pkUsSIVVX,https://sudact.ru/regular/doc/8U4pkUsSIVVX/,sudact.ru,Решение № 2-4556/2025 2-4556/2025~М-3007/2025... :: СудАкт.ру,"В силу пункта 5 статьи 28 Закона Российской Федерации «О защите прав потребителей» в случае нарушения установленных сроков выполнения работы (оказания услуги) или назначенных потребителем на основании пункта 1 настоящей статьи новых сроков исполнитель уплачивает потребителю за каждый день (час, если срок определен в часах) просрочки неустойку (пеню) в размере трех процентов цены выполнения работы (оказания услуги), а если цена выполнения."
WBfIewmrCUQH,https://sudact.ru/regular/doc/WBfIewmrCUQH/,sudact.ru,Решение № 2-3176/2020 от 26 июля 2020 г. по делу... :: СудАкт.ру,"Согласно пункту 1 статьи 31 Закона о защите прав потребителей требования потребителя об уменьшении цены за выполненную работу (оказанную услугу), о возмещении расходов по устранению недостатков выполненной работы (оказанной услуги) своими силами или третьими лицами, а также о возврате уплаченной за работу (услугу) денежной суммы и возмещении убытков, причиненных в связи с отказом от исполнения договора, предусмотренные пунктом 1 статьи 28."
ZwT0slBVSQm,https://sudact.ru/regular/doc/ZwT0slBVSQm/,sudact.ru,Решение № 2-3352/2019 2-502/2020 2-502/2020... :: СудАкт.ру,"о защите прав потребителей в случае нарушения установленных сроков удовлетворения требований потребителя исполнитель уплачивает потребителю за каждый день (час, если срок определен в часах) просрочки неустойку (пеню) в размере трех процентов цены выполнения работы (оказания услуги), а если цена выполнения работы (оказания услуги) договором о выполнении работ (оказании услуг) не определена - общей цены заказа."
sei0HpVRwcHH,https://sudact.ru/regular/doc/sei0HpVRwcHH/,sudact.ru,Решение № 2-4143/2021 2-4143/2021~М-1189/2021... :: СудАкт.ру,"Согласно части 5 статьи 28 Закона РФ «О защите прав потребителей» в случае нарушения установленных сроков выполнения работы (оказания услуги) или назначенных потребителем на основании пункта 1 настоящей статьи новых сроков исполнитель уплачивает потребителю за каждый день (час, если срок определен в часах) просрочки неустойку (пеню) в размере трех процентов цены выполнения работы (оказания услуги), а если цена выполнения работы (оказания. услуги) договором о выполнении работ..."
VEVEnx8fQhW5,https://sudact.ru/regular/doc/VEVEnx8fQhW5/,sudact.ru,Решение № 2-301/2020 2-301/2020(2-5023/2019...) :: СудАкт.ру,"В соответствии с пунктом 5 статьи 28 Закона РФ ""О защите прав потребителей"" в случае нарушения установленных сроков выполнения работы (оказания услуги) или назначенных потребителем на основании пункта 1 настоящей статьи новых сроков исполнитель уплачивает потребителю за каждый день (час, если срок определен в часах) просрочки неустойку (пеню) в размере трех процентов цены выполнения работы (оказания услуги)."
zCfOD70dZF1,https://sudact.ru/regular/doc/zCfOD70dZF1/,sudact.ru,Решение № 2-420/2021 2-420/2021~М-235/2021... :: СудАкт.ру,"Доказательств в опровержение данных обстоятельств, о том, что до потребителя перед приобретением последним товара была доведена полная и достоверная информация о товаре, в том числе об ограничениях его использования, не предоставлено. В связи с этим суд приходит к выводу о том, что требования, установленные статьями 8, 10 Закона РФ «О защите прав потребителей» продавцом не были выполнены в полном объеме."
VUbLq3N4mHLg,https://sudact.ru/regular/doc/VUbLq3N4mHLg/,sudact.ru,Решение № 2-831/2023 2-831/2023~М-610/2023... :: СудАкт.ру,"Статьей 12 Закона о защите прав потребителей предусмотрено, что, если потребителю не предоставлена возможность незамедлительно получить при заключении договора информацию о товаре (работе, услуге), он вправе потребовать от продавца (исполнителя) возмещения убытков, причиненных необоснованным уклонением от заключения договора, а если договор заключен, в разумный срок отказаться от его исполнения и потребовать возврата уплаченной за товар суммы и возмещения других убытков (пункт."
