docid,url,domain,title,passage
3EKlRihBcpmt,https://sudact.ru/regular/doc/3EKlRihBcpmt/,sudact.ru,Решение № 2-2224/2020 2-2224/2020~М-2054/2020... :: СудАкт.ру,"В соответствии с пунктом 3 статьи 31 Закона о защите прав потребителей за нарушение предусмотренных настоящей статьей сроков удовлетворения отдельных требований потребителя исполнитель уплачивает потребителю за каждый день просрочки неустойку (пеню), размер и порядок исчисления которой определяются в соответствии с пунктом 5 статьи 28 настоящего Закона. Вместе с тем, истцом заявлены требования о взыскании неустойки за нарушения срока удовлетворения требования потребителя."
QqSw46fUvPr,https://sudact.ru/regular/doc/QqSw46fUvPr/,sudact.ru,Решение № 2-215/2020 2-215/2020~М-174/2020... :: СудАкт.ру,"Согласно, п. 5 ст. 28 Закона Российской Федерации ""О защите прав потребителей"", согласно которому в случае нарушения установленных сроков выполнения работы (оказания услуги) или назначенных потребителем на основании пункта 1 настоящей статьи новых сроков исполнитель уплачивает потребителю за каждый день (час, если срок определен в часах) просрочки неустойку (пеню) в размере трех процентов цены выполнения работы (оказания услуги), а если цена."
DcaXct4mB3UK,https://sudact.ru/regular/doc/DcaXct4mB3UK/,sudact.ru,Решение № 2-243/2020 2-243/2020~М-1743/2019... :: СудАкт.ру,"Согласно пункту 5 статьи 28 Закона РФ ""О защите прав потребителей"" в случае нарушения установленных сроков выполнения работы (оказания услуги) или назначенных потребителем на основании пункта 1 настоящей статьи новых сроков исполнитель уплачивает потребителю за каждый день (час, если срок определен в часах) просрочки неустойку (пеню) в размере трех процентов цены выполнения работы (оказания услуги), а если цена выполнения работы (оказания."
dDvjXR3GKwxb,https://sudact.ru/regular/doc/dDvjXR3GKwxb/,sudact.ru,Решение № 2-16/2020 2-16/2020(2-443/2019...) :: СудАкт.ру,"Согласно части 5 статьи 28 Закона о защите прав потребителей сумма неустойки не может превышать <данные изъяты> рублей. | Неустойка (пеня) за нарушение сроков окончания выполнения работы (оказания услуги), ее этапа взыскивается за каждый день (час, если срок определен в часах) просрочки вплоть до окончания выполнения работы (оказания услуги), ее этапа или предъявления потребителем требований, предусмотренных пунктом 1 настоящей статьи."
xFynck7nm1gW,https://sudact.ru/regular/doc/xFynck7nm1gW/,sudact.ru,Решение № 2-2330/2020 2-2330/2020~М-845/2020... :: СудАкт.ру,"Указала, что согласно пункту 5 статьи 28 Закона о защите прав потребителей в случае нарушения установленных сроков выполнения работы (оказания услуги) или назначенных потребителем на основании пункта 1 названной статьи новых сроков исполнитель уплачивает потребителю за каждый день просрочки неустойку (пеню) в размере трех процентов цены выполнения работы (оказания услуги), а если цена выполнения работы (оказания услуги) договором о выполнении работ."
xaPFd5m1V86i,https://sudact.ru/regular/doc/xaPFd5m1V86i/,sudact.ru,Решение № 2-634/2020 2-634/2020(2-7152/2019...) :: СудАкт.ру,"Исполнитель обязан осуществить выполнение работ в срок, установленный договором (пункт 1 статьи 27 Закона Российской Федерации «О защите прав потребителей»). | В соответствии с пунктом 5 статьи 28 Закона Российской Федерации «О защите прав потребителей» в случае нарушения установленных сроков выполнения работы, или назначенных потребителем новых сроков, исполнитель уплачивает потребителю за каждый день просрочки неустойку (пеню) в размере трех процентов цены выполнения работы."
SKRzPTr0mYmR,https://sudact.ru/regular/doc/SKRzPTr0mYmR/,sudact.ru,Решение № 2-579/2020 2-579/2020(2-6552/2019...) :: СудАкт.ру,"2300-1 «О защите прав потребителей», то удовлетворение требований потребителя подлежит добровольному исполнению в десятидневный срок. Ответчик ООО «АльфаСтрахование-Жизнь» исполнило требование о возврате денежных средств по истечении 51 дня со дня обращения, в связи с чем с ООО «АльфаСтрахование-Жизнь» подлежит взысканию неустойка на основании п.5 ст.28 Закона РФ «О защите прав потребителей»."
lbZPxqLTQJro,https://sudact.ru/regular/doc/lbZPxqLTQJro/,sudact.ru,Решение № 2-2036/2025 2-2036/2025~М-1983/2025... :: СудАкт.ру,"Согласно п. 5 ст. 28 указанного Закона «О защите прав потребителей» установлено, что в случае нарушения установленных сроков выполнения работы (оказания услуги) или назначенных потребителем на основании п. 1 ст. 28 новых сроков исполнитель уплачивает потребителю за каждый день (час, если срок определен в часах) просрочки неустойку (пеню) в размере 3% цены выполнения работы (оказания услуги), а если цена выполнения работы."
KHjybr1tjlQ4,https://sudact.ru/regular/doc/KHjybr1tjlQ4/,sudact.ru,Решение № 2-298/2020 2-298/2020~М-86/2020... :: СудАкт.ру,"Истец, предъявляя требование о взыскании неустойки ссылается на пункт 5 ст.28 Закона РФ «О защите прав потребителей«, в котором указано, что в случае нарушения установленных сроков выполнения работы (оказания услуги) или назначенных потребителем на основании пункта 1 настоящей статьи новых сроков исполнитель уплачивает потребителю за каждый день (час, если срок определен в часах) просрочки неустойку (пеню) в размере трех процентов цены выполнения."
oakTTFmKQb5J,https://sudact.ru/regular/doc/oakTTFmKQb5J/,sudact.ru,Решение № 2-2090/2020 2-2090/2020~М-1545/2020... :: СудАкт.ру,"Согласно ч. 5 ст. 28 Закона Российской Федерации от 07 февраля 1992 года N 2300-1 ""О защите прав потребителей"" в случае нарушения установленных сроков выполнения работы (оказания услуги) или назначенных потребителем на основании пункта 1 настоящей статьи новых сроков исполнитель уплачивает потребителю за каждый день (час, если срок определен в часах) просрочки неустойку (пеню) в размере трех процентов цены выполнения работы (оказания."
TRJAjBS3H41P,https://sudact.ru/regular/doc/TRJAjBS3H41P/,sudact.ru,Решение № 2-454/2019 2-454/2019~М-544/2019... :: СудАкт.ру,"Согласно п.5 ст.28 Закона РФ О защите прав потребителей, в силу которого в случае нарушения установленных сроков выполнения работы (оказания услуги) или назначенных потребителем на основании пункта 1 настоящей статьи новых сроков исполнитель уплачивает потребителю за каждый день (час, если срок определен в часах) просрочки неустойку (пеню) в размере трех процентов цены выполнения работы (оказания услуги), а если цена."
tGOym2Rdgd5r,https://sudact.ru/regular/doc/tGOym2Rdgd5r/,sudact.ru,Решение № 2-4664/2025 2-4664/2025~М-3971/2025... :: СудАкт.ру,"В соответствии с п. 5 ст. 28 Закона РФ от ДД.ММ.ГГГГ № ""О защите прав потребителей"" в случае нарушения установленных сроков выполнения работы (оказания услуги) или назначенных потребителем на основании пункта 1 настоящей статьи новых сроков исполнитель уплачивает потребителю за каждый день (час, если срок определен в часах) просрочки неустойку (пеню) в размере трех процентов цены выполнения работы (оказания услуги)."
z78ERmxhRjxq,https://sudact.ru/regular/doc/z78ERmxhRjxq/,sudact.ru,Решение № 2-820/2020 2-85/2021 2-85/2021(2-820/2020... :: СудАкт.ру,"На основании п. 5 ст. 28 Федерального закона «О защите прав потребителей», в случае нарушения установленных сроков выполнения работы (оказания услуги) или назначенных потребителем на основании пункта 1 настоящей статьи новых сроков исполнитель уплачивает потребителю за каждый день (час, если срок определен в часах) просрочки неустойку (пеню) в размере трех процентов цены выполнения работы (оказания услуги), а если цена выполнения работы."
ZPPMKmYhEXYQ,https://sudact.ru/regular/doc/ZPPMKmYhEXYQ/,sudact.ru,Решение № 2-944/2017 от 15 августа 2017 г. по делу... :: СудАкт.ру,"Статья 23.1 ч. 1 ч. 2 ч. 3 ч. 4 ч. 5 Закона «О защите прав потребителей» предусматривает, что договор купли-продажи, предусматривающий обязанность потребителя предварительно оплатить товар, должен содержать условие о сроке передачи товара потребителю. В случае, если продавец, получивший сумму предварительной оплаты в определенном договором купли-продажи размере, не исполнил обязанность по передаче товара потребителю в установленный таким договором срок, потребитель по своему выбору вправе потребовать"
3upYOEUsOC6X,https://sudact.ru/regular/doc/3upYOEUsOC6X/,sudact.ru,Решение № 2-1/2024 2-1/2024~М-8177/2023... :: СудАкт.ру,"Пунктом 3 статьи 23.1 Закона РФ «О защите прав потребителей» установлено, что в случае нарушения установленного договором купли-продажи срока передачи предварительно оплаченного товара потребителю продавец уплачивает ему за каждый день просрочки неустойку (пени) в размере половины процента суммы предварительной оплаты товара."
Sc6rzP15X355,https://sudact.ru/regular/doc/Sc6rzP15X355/,sudact.ru,Решение № 2-12108/2019 2-2256/2020 2-2256/2020... :: СудАкт.ру,"Согласно части 2 статьи 23.1 Закона РФ ""О защите прав потребителей"" в случае, если продавец, получивший сумму предварительной оплаты в определенном договором купли-продажи размере, не исполнил обязанность по передаче товара потребителю в установленный таким договором срок, потребитель по своему выбору вправе потребовать: передачи оплаченного товара в установленный им новый срок; возврата суммы предварительной оплаты товара, не переданного продавцом."
g2mB62RIjp6Q,https://sudact.ru/regular/doc/g2mB62RIjp6Q/,sudact.ru,Решение № 2-2254/2024 2-2254/2024~М-1600/2024... :: СудАкт.ру,"В соответствии с частями 1-3, 5 статьи 23.1 Закона Российской Федерации «О защите прав потребителей» договор купли-продажи, предусматривающий обязанность потребителя предварительно оплатить товар, должен содержать условие о сроке передачи товара потребителю. В случае, если продавец, получивший сумму предварительной оплаты в определенном договором купли-продажи размере, не исполнил обязанность по передаче товара потребителю в установленный таким договором срок, потребитель по своему..."
uhug73HSdyYX,https://sudact.ru/regular/doc/uhug73HSdyYX/,sudact.ru,Решение № 2-168/2019 2-168/2019~М-146/2019... :: СудАкт.ру,"Согласно пункту 3 статьи 487 ГК РФ в случае, когда продавец, получивший сумму предварительной оплаты, не исполняет обязанность по передаче товара в установленный срок (статья 457 ГК РФ), покупатель вправе потребовать передачи оплаченного товара или возврата суммы предварительной оплаты за товар, не переданный продавцом. Аналогичные положения содержит статья 23.1 Закона Российской Федерации от 07.02.1992 № 2300-1 «О защите прав потребителей» (далее – Закон «О защите прав потребителей»)."
jxrhPThJ8fL4,https://sudact.ru/regular/doc/jxrhPThJ8fL4/,sudact.ru,Решение № 2-1086/2020 от 14 июля 2020 г. по делу... :: СудАкт.ру,"Кроме того, в силу ст. 23.1 Закона «О защите прав потребителей»: 1. Договор купли-продажи, предусматривающий обязанность потребителя предварительно оплатить товар, должен содержать условие о сроке передачи товара потребителю. 2. В случае, если продавец, получивший сумму предварительной оплаты в определенном договором купли-продажи размере, не исполнил обязанность по передаче товара потребителю в установленный таким договором срок, потребитель по своему выбору вправе потребовать"
Pp6bfruXoRrw,https://sudact.ru/regular/doc/Pp6bfruXoRrw/,sudact.ru,Решение № 2-620/2025 от 28 апреля 2025 г. по делу... :: СудАкт.ру,"Согласно статье 23.1 Закона о защите прав потребителей договор купли-продажи, предусматривающий обязанность потребителя предварительно оплатить товар, должен содержать условие о сроке передачи товара потребителю (пункт 1). В случае, если продавец, получивший сумму предварительной оплаты в определенном договором купли-продажи размере, не исполнил обязанность по передаче товара потребителю в установленный таким договором срок, потребитель по своему выбору вправе потребовать"
a9CAweL5gwWP,https://sudact.ru/regular/doc/a9CAweL5gwWP/,sudact.ru,Решение № 2-3632/2019 2-476/2020 2-476/2020... :: СудАкт.ру,"Согласно части 2 статьи 23.1Закона Российской Федерацииот 07.02.1992 № 2300-1 ""О защите прав потребителей"" в случае, если продавец, получивший сумму предварительной оплаты в определенном договором купли-продажи размере, не исполнил обязанность по передаче товара потребителю в установленный таким договором срок, потребитель по своему выбору вправе потребовать возврата суммы предварительной оплаты товара, не переданного продавцом."
A9DmPtvwhmrK,https://sudact.ru/regular/doc/A9DmPtvwhmrK/,sudact.ru,Решение № 2-383/2020 2-383/2020~М-184/2020... :: СудАкт.ру,"Положениями п. 2 ст. 23.1 «Закона о защите прав потребителей» установлено, что в случае, если продавец, получивший сумму предварительной оплаты в определённом договором купли-продаже размере, не исполнил обязанность по передаче товара потребителю в установленный таким договором срок, потребитель по своему выбору вправе потребовать: передачи оплаченного товара в установленный им новый срок; возврата суммы предварительной оплаты товара, не переданного продавцом."
fej8tAz2p8NP,https://sudact.ru/regular/doc/fej8tAz2p8NP/,sudact.ru,Решение № 2-1951/2020 2-1951/2020~М-1174/2020... :: СудАкт.ру,В силу части 3 статьи 23.1 Закона о защите прав потребителя в случае нарушения установленного договором купли-продажи срока передачи предварительно оплаченного товара потребителю продавец уплачивает ему за каждый день просрочки неустойку (пени) в размере половины процента суммы предварительной оплаты товара.
c7aHcUwzLKZI,https://sudact.ru/regular/doc/c7aHcUwzLKZI/,sudact.ru,Решение № 2-2682/2020 2-2682/2020~М-1667/2020... :: СудАкт.ру,"В силу статьи 23.1 Закона Российской Федерации «О защите прав потребителей» в случае, если продавец, получивший сумму предварительной оплаты в определенном договором купли-продажи размере, не исполнил обязанность по передаче товара потребителю в установленный таким договором срок, потребитель по своему выбору вправе потребовать: передачи оплаченного товара в установленный им новый срок; возврата суммы предварительной оплаты товара, не переданного продавцом."
qhVLhQxpwYYw,https://sudact.ru/regular/doc/qhVLhQxpwYYw/,sudact.ru,Решение № 2-99/2020 2-99/2020~М-3/2020 М-3/2020 от... :: СудАкт.ру,"В соответствии со статьей 23.1 Закона «О защите прав потребителей» договор купли-продажи, предусматривающий обязанность потребителя предварительно оплатить товар, должен содержать условие о сроке передачи товара потребителю. В случае, если продавец, получивший сумму предварительной оплаты в определенном договором купли-продажи размере, не исполнил обязанность по передаче товара потребителю в установленный таким договором срок, потребитель по своему выбору вправе потребовать: передачи..."
NOXVZP9ifzoS,https://sudact.ru/regular/doc/NOXVZP9ifzoS/,sudact.ru,Решение № 2-3519/2020 2-3519/2020~М-1525/2020... :: СудАкт.ру,"В силу части 2 статьи 23.1 Закона Российской Федерации от 07 февраля 1992 года N 2300-1 ""О защите прав потребителей"" в случае, если продавец, получивший сумму предварительной оплаты в определенном договором купли-продажи размере, не исполнил обязанность по передаче товара потребителю в установленный таким договором срок, потребитель по своему выбору вправе потребовать: передачи оплаченного товара в установленный им новый срок; возврата."
BaVofnayDI5X,https://sudact.ru/regular/doc/BaVofnayDI5X/,sudact.ru,Решение № 2-70/2022 2-70/2022~М-16/2022 М-16/2022... :: СудАкт.ру,"Закона «О защите прав потребителей», в котором указано, что в случае нарушения установленного договором купли-продажи срока передачи предварительно оплаченного товара потребителю продавец уплачивает ему за каждый день просрочки неустойку (пени) в размере половины процента суммы предварительной оплаты товара»."
