docid,url,domain,title,passage
kGx5XJ5vQurZ,https://sudact.ru/regular/doc/kGx5XJ5vQurZ/,sudact.ru,Решение № 2-303/2020 2-303/2020~М-55/2020... :: СудАкт.ру,"Сумма взысканной потребителем неустойки (пени) не может превышать сумму предварительной оплаты товара. Требования потребителя, установленные пунктом 2 этой же статьи, не подлежат удовлетворению, если продавец докажет, что нарушение сроков передачи потребителю предварительно оплаченного товара произошло вследствие непреодолимой силы или по вине потребителя (пункт 5 статьи 23.1 Закона «О защите прав потребителей»)."
mxveZjjJGx6C,https://sudact.ru/regular/doc/mxveZjjJGx6C/,sudact.ru,Решение № 2-4824/2020 2-793/2021 2-793/2021... :: СудАкт.ру,"ст.23 Федерального закона «О защите прав потребителей» в размере 86730 руб., неустойку, предусмотренную ст.395 ГК РФ, в размере 1007,11 руб., расходы на оплату услуг представителя в размере 15 000 руб. | В соответствии со ст. 23.1 Закона Российской Федерации от 07.02.1992 № 2300-1 «О защите прав потребителей» договор купли-продажи, предусматривающий обязанность потребителя предварительно оплатить товар, должен содержать условие о сроке передачи товара потребителю."
mzhb1n8MfNod,https://sudact.ru/regular/doc/mzhb1n8MfNod/,sudact.ru,Решение № 2-2428/2019 2-2428/2019~М-2185/2019... :: СудАкт.ру,"Из части 3 статьи 23.1 Закона РФ от 07.02.1992 № 2300-1 «О защите прав потребителей следует, что в случае нарушения установленного договором купли-продажи срока передачи предварительно оплаченного товара потребителю продавец уплачивает ему за каждый день просрочки неустойку (пени) в размере половины процента суммы предварительной оплаты товара."
zCfOD70dZF1,https://sudact.ru/regular/doc/zCfOD70dZF1/,sudact.ru,Решение № 2-420/2021 2-420/2021~М-235/2021... :: СудАкт.ру,"Существенным признается нарушение договора одной из сторон, которое влечет для другой стороны такой ущерб, что она в значительной степени лишается того, на что была вправе рассчитывать при заключении договора. В соответствии со ст. 10 Закона РФ «О защите прав потребителей» изготовитель (исполнитель, продавец) обязан своевременно предоставлять потребителю необходимую и достоверную информацию о товарах (работах, услугах), обеспечивающую возможность их правильного выбора."
nfLIiVfnIsbj,https://sudact.ru/regular/doc/nfLIiVfnIsbj/,sudact.ru,Решение № 2-1233/2023 2-1233/2023~М-443/2023 М-443/2023 от 12...,"Владелец агрегатора не несет ответственность за убытки, причиненные потребителю вследствие предоставления ему недостоверной или неполной информации о товаре (услуге), в случае, если владелец агрегатора не изменяет информацию о товаре (услуге), предоставленную продавцом (исполнителем) и содержащуюся в предложении о заключении договора купли- продажи (договора возмездного оказания услуг). Пунктом 2 ст. 23.1 ФЗ «О Защите прав потребителей» установлено, что в случае, если продавец..."
wzkaHAf8E21E,https://sudact.ru/regular/doc/wzkaHAf8E21E/,sudact.ru,Решение № 2-1742/2025 2-1742/2025~М-810/2025... :: СудАкт.ру,"В связи с этим, в силу пункта 2.1 статьи 12 Закона РФ ""О защите прав потребителей"" ответчик несет ответственность за убытки, причиненные истцу вследствие предоставления недостоверной информации о продавце. | от ДД.ММ.ГГГГ на сумму 309,60 руб. Несение указанных расходов обосновано реализацией истцом своих прав, предусмотренных Законом РФ ""О защите прав потребителей"", а также правом на обращение в суд, в связи с чем, суд признает данные расходы необходимыми."
VUbLq3N4mHLg,https://sudact.ru/regular/doc/VUbLq3N4mHLg/,sudact.ru,Решение № 2-831/2023 2-831/2023~М-610/2023... :: СудАкт.ру,"Согласно договору купли-продажи автомобиль приобретался с пробегом, но при этом продавец обязан был предоставить потребителю достоверную информацию о его пробеге, данные параметры влияли на определение сторонами цены транспортного средства. Доводы ответчика о том, что именно потребителем предоставлена кредитной организации недостоверная информация о пробеге автомобиля 32 000 км, отклоняются судом. Согласно части 5 статьи 10 ГК РФ добросовестность участников гражданских правоотношений и разумность их..."
SW7BQ3oEiqbU,https://sudact.ru/regular/doc/SW7BQ3oEiqbU/,sudact.ru,Решение № 2-2119/2020 2-2119/2020~М-1924/2020... :: СудАкт.ру,"Следовательно, при подписании договора купли-продажи транспортного средства ООО ""МБ-Тверь"" предоставило истцу ненадлежащую информацию о товаре (работах, услуге), что является грубейшим нарушением ст. 10 Закона РФ ""О защите прав потребителей"". Статья 12 Закона РФ ""О защите прав потребителей"" дает право истцу отказаться от исполнения договора купли-продажи и потребовать возврата оплаченных по договору денежных средств."
JFu0uFMkN6QK,https://sudact.ru/regular/doc/JFu0uFMkN6QK/,sudact.ru,Решение № 2-1277/2020 2-1277/2020~М-239/2020... :: СудАкт.ру,"С учетом уточненных исковых требований, истец просил суд признать недостоверной и нарушившей его право, как потребителя, на информацию, а именно указание в ярлыке ООО ""ЛУКАС-ГОЛД"" браслета Артикул: B01-C-BL000210GK на изготовление данного ювелирного изделия ОАО «МЮЗ». | Права потребителя, вследствие не предоставления ему полной и достоверной информации, в том числе и предоставления недостоверной информации о товаре, указаны в статье 12 Закона защите прав потребителей."
yKzioxtguMYK,https://sudact.ru/regular/doc/yKzioxtguMYK/,sudact.ru,Решение № 2-619/2020 2-619/2020~М-401/2020... :: СудАкт.ру,"Согласно статье 10 Закона о защите прав потребителей изготовитель (исполнитель, продавец) обязан своевременно предоставлять потребителю необходимую и достоверную информацию о товарах (работах, услугах), обеспечивающую возможность их правильного выбора. Как следует из пункта 2 статьи 16 Закона о защите прав потребителей, запрещается обусловливать приобретение одних товаров (работ, услуг) обязательным приобретением иных товаров (работ, услуг)."
F4tgfJ83SDl1,https://sudact.ru/regular/doc/F4tgfJ83SDl1/,sudact.ru,Решение № 2-484/2023 2-484/2023~М-429/2023 М-429/2023 от 12...,"Согласно разъяснениям, изложенным в пункте 44 Постановления Пленума Верховного Суда РФ от 28 июня 2012 года №17 «О рассмотрении судами гражданских дел по спорам о защите прав потребителей», при рассмотрении требований потребителя о возмещении убытков, причиненных ему недостоверной или недостаточно полной информацией о товаре (работе, услуге), суду следует исходить из предположения об отсутствии у потребителя специальных познаний о его свойствах."
Z6ECxE1FZGbR,https://sudact.ru/regular/doc/Z6ECxE1FZGbR/,sudact.ru,Решение № 2-1135/2023 2-1135/2023~М-958/2023... :: СудАкт.ру,"ФИО1 обратилась в суд с иском к ООО «ЭОС» о защите прав потребителя, в котором просила обязать ООО «ЭОС» внести в БКИ АО «ОКБ» информацию о том, что у нее не имеется обязательств и задолженности перед ООО «ЭОС» по договору №-MSC-R62-VQ44-0047 от 10/07/2012 года в сумме 372321.71 рубля, взыскать с ООО «ЭОС» в. | Ответственность за невнесение достоверной информации/передачу недостоверной информации в бюро кредитных историй несет источник формирования кредитной истории."
lOvgUPRb4KVZ,https://sudact.ru/regular/doc/lOvgUPRb4KVZ/,sudact.ru,Решение № 2-153/2020 2-153/2020~М-35/2020... :: СудАкт.ру,"В свою очередь, с учетом вышеприведенных норм собственник помещений в многоквартирном доме должен быть своевременно проинформирован о предстоящей плате за коммунальные услуги и ему должны своевременно выставляться платежные документы. Согласно пунктам 1, 2 статьи 10 Закона Российской Федерации от 07.02.1992 № 2300-1 «О защите прав потребителей» исполнитель обязан своевременно предоставлять потребителю необходимую и достоверную информацию об услугах..."
qUSClQ9f9n5N,https://sudact.ru/regular/doc/qUSClQ9f9n5N/,sudact.ru,Решение № 2-695/2020 2-695/2020~М-573/2020... :: СудАкт.ру,"В статье 22 Закона о защите прав потребителей установлено, что требования потребителя о возврате уплаченной за товар денежной суммы подлежат удовлетворению продавцом в течение десяти дней со дня предъявления соответствующего требования. За нарушение указанного срока удовлетворения законного требования потребителя пунктом 1 статьи 23 Закона о защите прав потребителей установлена ответственность в виде неустойки, которую продавец, допустивший такое нарушение..."
QsoUZnTzldHU,https://sudact.ru/regular/doc/QsoUZnTzldHU/,sudact.ru,Решение № 2-2251/2019 2-53/2020 2-53/2020... :: СудАкт.ру,"Положениями статей 8, 10 Закона РФ ""О защите прав потребителей"" статьями 8, 10 Закона Российской Федерации от 7 февраля 1992 года N 2300-1 ""О защите прав потребителей"" предусмотрена обязанность исполнителя предоставлять потребителю необходимую и достоверную информацию об услугах, обеспечивающую возможность их правильного выбора. Согласно п. 4 ст. 12 Закона РФ ""О защите прав потребителей"" при рассмотрении требований потребителя о возмещении убытков, причиненных недостоверной или..."
6zydJ9jGUgoa,https://sudact.ru/regular/doc/6zydJ9jGUgoa/,sudact.ru,Решение № 2-375/2020 2-375/2020~М-107/2020... :: СудАкт.ру,"В процессе пользования товаром потребитель обнаружил следующие недостатки: вышел из строя и перестал определяться ноутбуком установленный жесткий диск HDD. В связи с чем, 16.01.2019 года, руководствуясь положениями статьи 18 Закона РФ «О защите прав потребителей», потребитель направил ответчику претензию с требованием соразмерного уменьшения покупной цены, претензия была получена ответчиком 25 января 2019 года, но ответа не последовало."
qING46DO7tmN,https://sudact.ru/regular/doc/qING46DO7tmN/,sudact.ru,Решение № 2-1404/2020 2-1404/2020~М-4783/2019... :: СудАкт.ру,"Согласно части 2 статьи 12 Закона РФ «О защите прав потребителей» продавец (исполнитель), не предоставивший покупателю полной и достоверной информации о товаре (работе, услуге), несет ответственность, предусмотренную пунктами 1 - 4 статьи 18 или пунктом 1 статьи 29 настоящего Закона, за недостатки товара (работы, услуги), возникшие после его передачи потребителю вследствие отсутствия у него такой информации."
P4XHDMeet1NZ,https://sudact.ru/regular/doc/P4XHDMeet1NZ/,sudact.ru,Решение № 2-2697/2018 от 9 сентября 2018 г. по делу... :: СудАкт.ру,"Статьей 10 Федерального закона от 07.02.1992 года N 2300-1 ""О защите прав потребителей"" предусмотрено, что исполнитель обязан своевременно предоставлять потребителю необходимую и достоверную информацию об услугах, обеспечивающую возможность их правильного выбора. По отдельным видам товаров (работ, услуг) перечень и способы доведения информации до потребителя устанавливаются Правительством Российской Федерации."
t2g2Kh4epVJ6,https://sudact.ru/regular/doc/t2g2Kh4epVJ6/,sudact.ru,Решение № 2-268/2021 2-268/2021~М-6/2021 М-6/2021... :: СудАкт.ру,"прав потребителей» потребитель вправе потребовать представления необходимой и достоверной информации об изготовителе (исполнителе, продавце), режиме его работы и реализуемых им товарах (работах, услугах). П.1 ст. 10 Закона о защите прав потребителей предусмотрено, что по отдельным видам товаров (работ, услуг) перечень и способы доведения информации до Потребителя устанавливаются Правительством РФ."
YcspRNYwowmP,https://sudact.ru/regular/doc/YcspRNYwowmP/,sudact.ru,Решение № 2-1414/2020 2-1414/2020~М-1282/2020... :: СудАкт.ру,"В соответствии со статьей 12 Закона РФ «О защите прав потребителей», если потребителю не предоставлена возможность незамедлительно получить при заключении договора информацию о товаре (работе, услуге), он вправе потребовать от продавца (исполнителя) возмещения убытков, причиненных необоснованным уклонением от заключения договора, а если договор заключен, в разумный срок отказаться от его исполнения и потребовать возврата уплаченной за товар суммы и возмещения других."
HZZImaYBl1oQ,https://sudact.ru/regular/doc/HZZImaYBl1oQ/,sudact.ru,Решение № 2-137/2020 2-137/2020~М-34/2020... :: СудАкт.ру,"Из положений пункта 4 статьи 12 Закона РФ от 07 февраля 1992 года N 2300-1 «О защите прав потребителей» следует, что при рассмотрении требований потребителя о возмещении убытков, причиненных недостоверной или недостаточно полной информацией о товаре (работе, услуге), необходимо исходить из предположения об отсутствии у потребителя специальных познаний о свойствах и характеристиках товара (работы, услуги)."
1MuNOiJg9Zgs,https://sudact.ru/regular/doc/1MuNOiJg9Zgs/,sudact.ru,Решение № 2-3852/2023 2-505/2024 2-505/2024... :: СудАкт.ру,"защите прав потребителей. В обоснование иска указала, что ДД.ММ.ГГГГ приобрела у ответчика ювелирные изделия – 15 обручальных колец, уплатив по договору купли-продажи общую стоимость товаров в размере 190 963 рублей. | При рассмотрении требований потребителя о возмещении убытков, причиненных недостоверной или недостаточно полной информацией о товаре, необходимо исходить из предположения об отсутствии у потребителя специальных познаний о свойствах и характеристиках товара."
hGeBUQ3DtW1C,https://sudact.ru/regular/doc/hGeBUQ3DtW1C/,sudact.ru,Решение № 2-1947/2018 2-58/2019 2-58/2019... :: СудАкт.ру,"В соответствии с пунктом 1 статьи 10 Закона РФ от 07 февраля 1992 года N 2300-1 ""О защите прав потребителей"" изготовитель (исполнитель, продавец) обязан своевременно предоставлять потребителю необходимую и достоверную информацию о товарах (работах, услугах), обеспечивающую возможность их правильного выбора."
lpuLB7g2UNH2,https://sudact.ru/regular/doc/lpuLB7g2UNH2/,sudact.ru,Решение № 2-1647/2019 2-45/2020 2-45/2020... :: СудАкт.ру,"В силу требований статьи 22 Закона о защите прав потребителя требование потребителя о возврате уплаченной за товар денежной суммы, а также требование о возмещении убытков, причиненных потребителю вследствие продажи товара ненадлежащего качества либо предоставления ненадлежащей информации о товаре, подлежат удовлетворению продавцом в течение 10 дней со дня предъявления соответствующего требования."
iuwDUUEqaxZT,https://sudact.ru/regular/doc/iuwDUUEqaxZT/,sudact.ru,Решение № 2-618/2020 2-618/2020~М-434/2020... :: СудАкт.ру,"Согласно пункту 4 статьи 12 названного Закона при рассмотрении требований потребителя о возмещении убытков, причиненных недостоверной или недостаточно полной информацией о товаре, необходимо исходить из предположения об отсутствии у потребителя специальных познаний о свойствах и характеристиках товара. Аналогичные положения приведены в пункте 44 постановления Пленума Верховного суда РФ от 28.06.2012 №17 «О рассмотрении судами гражданских дел по спорам о защите прав потребителей»."
JO6nC22ctEQ9,https://sudact.ru/regular/doc/JO6nC22ctEQ9/,sudact.ru,Решение № 2-413/2021 2-413/2021~М-312/2021... :: СудАкт.ру,"Согласно статье 10 вышеназванного Закона изготовитель (исполнитель, продавец) обязан своевременно предоставлять потребителю необходимую и достоверную информацию о товарах (работах, услугах), обеспечивающую возможность их правильного выбора. | делу в соответствии со статьей 220 ГПК РФ. Только в этом случае штраф, предусмотренный пунктом 6 статьи 13 Закона о защите прав потребителей, с ответчика не взыскивается."
p103xklic1mg,https://sudact.ru/regular/doc/p103xklic1mg/,sudact.ru,Решение № 2-1922/2025 2-1922/2025~М-540/2025... :: СудАкт.ру,"Иск ФИО1 к ООО «Маркетплейс» о защите прав потребителя удовлетворить частично. Взыскать с ООО «Маркетплейс» (ИНН <***>) в пользу ФИО1 (паспорт №) убытки в виде разницы стоимости товара в размере 1607000 руб., неустойку за период с 15.12.2024 по 13.05.2025 в размере 170000 руб., компенсацию морального вреда в размере 5 000 руб., штраф за несоблюдение в добровольном порядке удовлетворения требований потребителя в размере 160000 руб."
